{
  "$schema": "https://json-schema.org/draft/2020-12/schema",
  "$id": "https://github.com/kynraze/dapps-and-tools/schema/listing.schema.json",
  "title": "dApps & tools listing",
  "type": "object",
  "additionalProperties": false,
  "required": ["id", "name", "category", "network", "status", "description", "links", "maintainers"],
  "properties": {
    "$schema": { "type": "string" },
    "id": { "type": "string", "pattern": "^[a-z0-9]+(-[a-z0-9]+)*$", "maxLength": 48, "description": "Same as the listing's directory name." },
    "name": { "type": "string", "minLength": 1, "maxLength": 40 },
    "category": {
      "enum": ["app", "defi", "staking", "rwa", "nft", "game", "virtual-world", "governance", "bridge", "wallet", "explorer", "analytics", "monitoring", "developer-tools", "infrastructure"],
      "description": "dApps: app, defi, staking, rwa, nft, game, virtual-world, governance, bridge. Tools: wallet, explorer, analytics, monitoring (validator and node alerting), developer-tools, infrastructure (RPC, indexers, relayers)."
    },
    "chains": { "type": "array", "minItems": 2, "uniqueItems": true, "items": { "type": "string" }, "description": "Only in shared/<id>/: two or more Explorer chain slugs from chains.json. A listing under chains/<chain>/ takes its chain from the folder and has no chains field." },
    "network": { "enum": ["mainnet", "testnet"] },
    "status": { "enum": ["open", "beta", "sunset"] },
    "description": { "type": "string", "minLength": 20, "maxLength": 220, "description": "One or two sentences, from the project's own material." },
    "appUrl": { "type": "string", "pattern": "^https://", "description": "The product itself, not its marketing page. Required unless status is sunset." },
    "coverPosition": { "type": "string", "pattern": "^(top|bottom|left|right|center)( (top|bottom|left|right|center|\\d{1,3}%))?$", "description": "CSS object-position for the 16:9 crop of the cover." },
    "links": {
      "type": "array",
      "items": {
        "type": "object",
        "additionalProperties": false,
        "required": ["kind", "href"],
        "properties": {
          "kind": { "enum": ["website", "docs", "github", "x", "telegram", "discord", "ios", "android", "token"] },
          "href": { "type": "string", "pattern": "^https://" }
        }
      }
    },
    "explorer": {
      "type": "array",
      "description": "Links into Kynraze Explorer pages. The Explorer resolves these; there is no free URL here.",
      "items": {
        "type": "object",
        "additionalProperties": false,
        "required": ["kind"],
        "properties": {
          "kind": { "enum": ["photon", "governance", "validator", "account", "analytics"] },
          "address": { "type": "string", "description": "Required for validator (operator address) and account." },
          "topic": { "type": "string", "description": "Required for analytics, e.g. staking or districts." }
        }
      }
    },
    "maintainers": { "type": "array", "minItems": 1, "items": { "type": "string", "pattern": "^[A-Za-z0-9](?:[A-Za-z0-9-]{0,38})$" }, "description": "GitHub handles who can approve changes to this listing." }
  }
}
