{
  "id": "districts",
  "name": "Districts",
  "category": "virtual-world",
  "network": "mainnet",
  "status": "open",
  "description": "A real-world themed virtual world where players claim land in real cities.",
  "appUrl": "https://app.districts.xyz/",
  "coverPosition": "center 62%",
  "links": [
    { "kind": "website", "href": "https://districts.xyz/" },
    { "kind": "token", "href": "https://www.realio.network/tokens/DSTRX" },
    { "kind": "x", "href": "https://x.com/districts_xyz" },
    { "kind": "telegram", "href": "https://t.me/districts_xyz" }
  ],
  "explorer": [{ "kind": "analytics", "topic": "districts" }],
  "maintainers": ["kynraze"]
}
